<?xml version="1.0" encoding="UTF-8"?>
<pbl:Publication xmlns:pbl="https://www.xscience.com/data/publication.xsd" xmlns:xsi="http://www.w3.org/2001/XMLSchema-instance" xsi:schemaLocation="https://www.xscience.com/data/publication.xsd publication.xsd ">
  <pbl:MetaData>
    <pbl:field_of_study>pbl:field_of_study</pbl:field_of_study>
    <pbl:paper_type>RESEARCH_PAPER</pbl:paper_type>
    <pbl:received>2001-01-01</pbl:received>
    <pbl:revisied>2001-01-01</pbl:revisied>
    <pbl:accepted>2001-01-01</pbl:accepted>
    <pbl:status>UPLOADED</pbl:status>
    <pbl:keywords>
      <pbl:keyword>pbl:keyword</pbl:keyword>
    </pbl:keywords>
  </pbl:MetaData>
  <pbl:Title>pbl:Title</pbl:Title>
  <pbl:Author>
    <pbl:Name>
      <pbl:First_name>pbl:First_name</pbl:First_name>
      <pbl:Last_name>pbl:Last_name</pbl:Last_name>
    </pbl:Name>
    <pbl:Affiliation>
      <pbl:Organization>pbl:Organization</pbl:Organization>
      <pbl:City>pbl:City</pbl:City>
      <pbl:Country>pbl:Country</pbl:Country>
    </pbl:Affiliation>
    <pbl:Academic_degree>pbl:Academic_degree</pbl:Academic_degree>
    <pbl:Email>ASD@GMAIL.COM</pbl:Email>
    <pbl:PhoneNumber>+38112312312312312312</pbl:PhoneNumber>
    <pbl:Signature>MA==</pbl:Signature>
  </pbl:Author>
  <pbl:Abstract>
    <pbl:content/>
  </pbl:Abstract>
  <pbl:Content>
    <pbl:Paragraph>
      <pbl:Paragraph_title>pbl:Paragraph_title</pbl:Paragraph_title>
      <pbl:Paragraph_content>
        <pbl:Quote>
          <pbl:Source>pbl:Source</pbl:Source>
          <pbl:Quote_content>pbl:Quote_content</pbl:Quote_content>
        </pbl:Quote>
      </pbl:Paragraph_content>
    </pbl:Paragraph>
  </pbl:Content>
  <pbl:References>
    <pbl:Reference>
      <pbl:Author>pbl:Author</pbl:Author>
      <pbl:Year>1</pbl:Year>
      <pbl:Title>pbl:Title</pbl:Title>
      <pbl:Place>pbl:Place</pbl:Place>
      <pbl:Reference_type>BOOK_REFERENCE</pbl:Reference_type>
    </pbl:Reference>
  </pbl:References>
  <pbl:Corresponding_author>
    <pbl:Name>
      <pbl:First_name>pbl:First_name</pbl:First_name>
      <pbl:Last_name>pbl:Last_name</pbl:Last_name>
    </pbl:Name>
    <pbl:Affiliation>
      <pbl:Organization>pbl:Organization</pbl:Organization>
      <pbl:City>pbl:City</pbl:City>
      <pbl:Country>pbl:Country</pbl:Country>
    </pbl:Affiliation>
    <pbl:Academic_degree>pbl:Academic_degree</pbl:Academic_degree>
    <pbl:Email>SSS@GMAIL.COM</pbl:Email>
    <pbl:PhoneNumber>+38112312312312312312</pbl:PhoneNumber>
    <pbl:Signature>MA==</pbl:Signature>
  </pbl:Corresponding_author>
</pbl:Publication>
